{
  "$schema": "https://json-schema.org/draft/2020-12/schema",
  "type": "object",
  "required": ["name", "era", "data"],
  "properties": {
    "name": { "type": "string" },
    "era": { "type": "string" },
    "description": { "type": "string" },
    "engine": { "type": "string" },
    "data": {
      "type": "object",
      "required": ["factions", "terrain", "structures"],
      "additionalProperties": { "type": "string" },
      "properties": {
        "factions": { "type": "string" },
        "terrain": { "type": "string" },
        "structures": { "type": "string" }
      }
    },
    "pending": {
      "type": "array",
      "items": { "type": "string" }
    },
    "meta": {
      "type": "object",
      "description": "戰役 UI 文案，由引擎 applyMeta() 在啟動時套用到 DOM",
      "properties": {
        "tags": {
          "type": "array",
          "items": { "type": "string" },
          "description": "戰役分類標籤，供戰役列表頁篩選。兩條軸：時代（三國／楚漢／東晉十六國…）+ 看點機制（火攻／水戰／圍城／以寡擊眾／武將單挑…）"
        },
        "title": { "type": "string" },
        "subtitle": { "type": "string" },
        "docTitle": { "type": "string" },
        "seal": { "type": "string" },
        "broadcastTag": { "type": "string" },
        "era": { "type": "string" },
        "eraYear": { "type": "string" },
        "intro": {
          "type": "object",
          "properties": {
            "tag": { "type": "string" },
            "bodyHtml": { "type": "string" },
            "footHtml": { "type": "string" }
          }
        },
        "finale": {
          "type": "object",
          "properties": {
            "title": { "type": "string" },
            "subtitle": { "type": "string" }
          }
        },
        "timeline": {
          "type": "object",
          "properties": {
            "start": { "type": "string" },
            "mid": { "type": "string" },
            "end": { "type": "string" }
          }
        }
      }
    }
  }
}
